{
  "schema": "vmc-song-catalog/v2",
  "schemaVersion": 2,
  "catalogVersion": 2,
  "publicBaseUrl": "https://terasgroup.github.io/VRChat_MaiSongs",
  "pack": {
    "packId": "example-pack",
    "name": "Example VMC Pack",
    "version": 2,
    "description": "VMC song pack repository with fixed VRChat runtime URL slots"
  },
  "runtime": {
    "slotCount": 512,
    "slotPadWidth": 4,
    "registryUrl": "https://terasgroup.github.io/VRChat_MaiSongs/runtime-url-registry.json",
    "audioExtensions": [
      ".mp3",
      ".ogg",
      ".wav",
      ".flac",
      ".aac",
      ".m4a"
    ],
    "backgroundVideoExtensions": [
      ".mp4",
      ".webm",
      ".mkv",
      ".avi",
      ".mov"
    ],
    "backgroundImageExtensions": [
      ".webp",
      ".png",
      ".jpg",
      ".jpeg",
      ".gif"
    ],
    "jacketExtensions": [
      ".webp",
      ".png",
      ".jpg",
      ".jpeg"
    ],
    "chartDifficulties": [
      1,
      2,
      3,
      4,
      5,
      6,
      7
    ]
  },
  "songCount": 3,
  "chartCount": 4,
  "songs": [
    {
      "songId": 10001,
      "runtimeSlot": 0,
      "version": 1,
      "enabled": true,
      "title": "Hello, SEKAI",
      "artist": "DECO*27",
      "bpm": 148,
      "genre": "",
      "tags": [],
      "media": {
        "audio": {
          "variant": 0,
          "extension": ".mp3",
          "preload": {
            "variant": 2,
            "extension": ".wav",
            "encoding": "pcm-f32le",
            "bytes": 53615276,
            "sampleRate": 48000,
            "channels": 2,
            "sampleFrames": 6701904,
            "sha256": "c107b98e096471c8ed2de9963b743868689096e8b1109b3431ad0b507fc5205e"
          }
        },
        "background": {
          "type": "image",
          "variant": 2,
          "extension": ".jpg"
        }
      },
      "jacket": {
        "variant": 2,
        "extension": ".jpg"
      },
      "charts": [
        {
          "chartId": 100015,
          "difficulty": 5,
          "level": "13",
          "designer": "MiraT",
          "version": 1
        }
      ]
    },
    {
      "songId": 10002,
      "runtimeSlot": 1,
      "version": 1,
      "enabled": true,
      "title": "前へススメ！",
      "artist": "Poppin'Party",
      "bpm": 181.01,
      "genre": "",
      "tags": [],
      "media": {
        "audio": {
          "variant": 0,
          "extension": ".mp3",
          "preload": {
            "variant": 2,
            "extension": ".wav",
            "encoding": "pcm-f32le",
            "bytes": 51847212,
            "sampleRate": 48000,
            "channels": 2,
            "sampleFrames": 6480896,
            "sha256": "bbc1f1959b694d18833d9211ef80828d122db9a22b30821395256bb79d9f3b63"
          }
        },
        "background": {
          "type": "image",
          "variant": 2,
          "extension": ".jpg"
        }
      },
      "jacket": {
        "variant": 2,
        "extension": ".jpg"
      },
      "charts": [
        {
          "chartId": 100025,
          "difficulty": 5,
          "level": "13",
          "designer": "小kai也算开",
          "version": 1
        }
      ]
    },
    {
      "songId": 10003,
      "runtimeSlot": 2,
      "version": 1,
      "enabled": true,
      "title": "BOW AND ARROW",
      "artist": "米津玄师",
      "bpm": 180,
      "genre": "",
      "tags": [],
      "media": {
        "audio": {
          "variant": 0,
          "extension": ".mp3",
          "preload": {
            "variant": 2,
            "extension": ".wav",
            "encoding": "pcm-f32le",
            "bytes": 32532524,
            "sampleRate": 44100,
            "channels": 2,
            "sampleFrames": 4066560,
            "sha256": "7210a71934ec339edf3b60661302aaa67b2cf38ce8aee0c07614a76f6aa29e6b"
          }
        },
        "background": {
          "type": "video",
          "variant": 0,
          "extension": ".mp4"
        }
      },
      "jacket": {
        "variant": 2,
        "extension": ".jpg"
      },
      "charts": [
        {
          "chartId": 100035,
          "difficulty": 5,
          "level": "13+",
          "designer": "fullower",
          "version": 1
        },
        {
          "chartId": 100036,
          "difficulty": 6,
          "level": "13+",
          "designer": "fullower",
          "version": 1
        }
      ]
    }
  ],
  "catalogSha256": "f1eef48d475eec7d58a8c4be8c56ebc7d39851370a299bc41111860536cf76ec"
}
